<?xml version="1.0" encoding="UTF-8"?>
<Scenario name="name, only for the designer" 
     xmlns="http://presstoplaygame.com/scenario"
          xmlns:xsi="http://www.w3.org/2001/XMLSchema-instance"
          xsi:schemaLocation="http://presstoplaygame.com/scenario scenario_schema.xsd"
          >
  <Events>
    <MultipleChoiceEvent >
      <Description>Policie pohřešuje osmiletou holčičku Aničku Novákovou.</Description>
      <Choices>
        <Choice>
          <Effects>
            <MoveTowardsEffect attribute="Credibility" value = "900"/>
          </Effects>
          <Title>Vyjádření policie</Title>
          <Description>Dívka odešla z domu po páté hodině odpoledne bez mobilního telefonu. Na sobě měla fialové tepláky a zelenkavou šusťákovou bundu.
            V případě, že můžete k výskytu pohřešované podat jakékoliv informace, volejte na bezplatnou linku 158.
          </Description>
        </Choice>
        <Choice>
          <Effects>
            <MoveTowardsEffect attribute="Credibility" value = "100"/>
          </Effects>
          <Title> Vyjádření sousedů</Title>
          <Description>Ztracená Anička: Další podezřelý je sexuální deviant! Matka se zhroutila!</Description>
        </Choice>
      </Choices>
    </MultipleChoiceEvent>
    <MultipleChoiceEvent>
      <Description>V Něměcku zaznamenáno přes 150.000 trestných činů souvisejících s uprchlickou krizí. 90% těchto činů se týká překročení státní hranice bez platných cestovních dokladů. </Description>
      <Choices>
        <Choice>
          <Effects>
            <MoveTowardsEffect attribute="Credibility" value = "1000"/>
          </Effects>
          <Title>Administrativní zátěž</Title>
          <Description>Uprchlická krize především přinesla administrativní zátěž
          </Description>
        </Choice>
        <Choice>
          <Effects>
            <MoveTowardsEffect attribute="Credibility" value = "0"/>
          </Effects>
          <Title>Vlna zločinu</Title>
          <Description>Co uprchlík to zločinec. Němci se začínají ozbrojovat.</Description>
        </Choice>
      </Choices>
    </MultipleChoiceEvent>
    <MultipleChoiceEvent>
      <Description>Výtěžek ze sbírky pro romskou rodinu paterčat zamrzl na účtu charity. Pro rodinu může být situace likvidační. </Description>
      <Choices>
        <Choice>
          <Effects>
            <MoveTowardsEffect attribute="Credibility" value = "800"/>
          </Effects>
          <Title>Věc řeší advokát</Title>
          <Description>
            Věc řeší advokát
          </Description>
        </Choice>
        <Choice>
          <Effects>
            <MoveTowardsEffect attribute="Credibility" value = "200"/>
          </Effects>
          <Title>Romská rodina se hádá o peníze ze sbírky</Title>
          <Description> Romská rodina se hádá o peníze ze sbírky.</Description>
        </Choice>
      </Choices>
    </MultipleChoiceEvent>
    <MultipleChoiceEvent>
      <Description>V Českých Budějovicích má vzniknout moderní kulturní multiplex od avantgardního architekta. Budova pojme až šest operních sálů.</Description>
      <Choices>
        <Choice>
          <Effects>
            <MoveTowardsEffect attribute="Credibility" value = "600"/>
          </Effects>
          <Title>Vyjádření odborníka</Title>
          <Description>
            “Je to unikátní projekt, který zvyší prestiž Českých Budějovic na mezinárodní urovni,” říká k návrhu operního sálu ve tvaru Olihně Tomáš Nejedlý z katedry architektury na ČVUT.
          </Description>
        </Choice>
        <Choice>
          <Effects>
            <MoveTowardsEffect attribute="Credibility" value = "400"/>
          </Effects>
          <Title>Anketa</Title>
          <Description>
            Prodavačka Jana (28): A peníze pro důchodce nejsou!
            Důchodkyně Věra (79): Já bych všechny ty multiplexy zakázala!
            Student střední školy (15): Mně se to líbí. Vypadá to jako penis.
          </Description>
        </Choice>
      </Choices>
    </MultipleChoiceEvent>
    <MultipleChoiceEvent>
      <Description> Na Teplicku skupují pozemky bohatí developeři z Arabských Emirátů.</Description>
      <Choices>
        <Choice>
          <Effects>
            <MoveTowardsEffect attribute="Credibility" value = "900"/>
          </Effects>
          <Title>Velká příležitost</Title>
          <Description>Do chudého regionu doputují milionové investice. Očekává se 10 000 nových pracovních míst.
          </Description>
        </Choice>
        <Choice>
          <Effects>
            <MoveTowardsEffect attribute="Credibility" value = "100"/>
          </Effects>
          <Title>Invaze</Title>
          <Description>Muslimští šejkové kolonizují Česko! Sociolog: Je otázkou času, kdy začnou zahalovat naše ženy!</Description>
        </Choice>
      </Choices>
    </MultipleChoiceEvent>
    <MultipleChoiceEvent>
      <Description>Vyjádření ministra vlády: “Ty velkoměsta tady začínají ovládat vegetariáni, nekuřáci, transvestiti, cyklisti, homosexuálové a já prostě potřebuju občas utýct na ten venkov, kde jsou ještě normální chlapi a ženský.”
      </Description>
      <Choices>
        <Choice>
          <Effects>
            <MoveTowardsEffect attribute="Credibility" value = "750"/>
          </Effects>
          <Title>Ignorovat</Title>
          <Description>
            ...
          </Description>
        </Choice>
        <Choice>
          <Effects>
            <MoveTowardsEffect attribute="Credibility" value = "250"/>
          </Effects>
          <Title>Publikovat</Title>
          <Description>Politik sebral odvahu a řekl natvrdo, co si každý myslí!</Description>
        </Choice>
      </Choices>
    </MultipleChoiceEvent>
  </Events>
</Scenario>
