<?xml version="1.0" encoding="UTF-8"?>
<Scenario name="Story scenario"
  xmlns="http://presstoplaygame.com/scenario"
          xmlns:xsi="http://www.w3.org/2001/XMLSchema-instance"
          xsi:schemaLocation="http://presstoplaygame.com/scenario ../../../Resources/Scenarios/scenario_schema.xsd"
          >
  <Events>
    <CutsceneEvent date="1989-11-17">
      <Preconditions>
      </Preconditions>
      <ImagePath>Path/To/Image</ImagePath>
      <Text>Game Start</Text>
    </CutsceneEvent>
    <CutsceneEvent date="1989-11-20">
      <Preconditions>
        <Precondition attribute = "Credibility" operation="lessOrEqual" value="500"/>
      </Preconditions>
      <ImagePath>Path/To/EventLowCredibility</ImagePath>
      <Text>EventLowCredibility</Text>
    </CutsceneEvent>
    <CutsceneEvent date="1989-11-22">
      <Preconditions>
        <Precondition attribute = "Credibility" operation="greater" value="500"/>
      </Preconditions>
      <ImagePath>Path/To/EventHighCredibility</ImagePath>
      <Text>EventHighCredibility</Text>
    </CutsceneEvent>
  </Events>
</Scenario>
