<?xml version="1.0" encoding="utf-8"?>
<?xml-stylesheet type="text/xsl" href="../../../Resources/Scenarios/scenario_stylesheet.xslt"?>
<Scenario name="name, only for the designer" xmlns="http://presstoplaygame.com/scenario" xmlns:xsi="http://www.w3.org/2001/XMLSchema-instance" xsi:schemaLocation="http://presstoplaygame.com/scenario ../../../Resources/Scenarios/scenario_schema.xsd">
  <Events>
    <MultipleChoiceEvent name="More credibility">
      <Preconditions>
        <Precondition attribute="Credibility" operation="greater" value="Money" />
      </Preconditions>
      <Description>Event 1 description
          </Description>
      <Choices>
        <Choice>
          <Effects>
            <SetEffect attribute="Money" value="0" />
          </Effects>
          <Description>
                      Choice 1 description
                  </Description>
          <ChoiceText>Choice 1</ChoiceText>
        </Choice>
        <Choice>
          <Effects>
            <ModifyEffect attribute="Credibility" value="150" />
            <MoveTowardsEffect amount="100" attribute="Credibility" value="500" />
          </Effects>
          <Description>
                      Choice 2 long description
                  </Description>
          <ChoiceText>Choice 2 ChoiceText</ChoiceText>
        </Choice>
      </Choices>
    </MultipleChoiceEvent>
    <MultipleChoiceEvent name="More money">
      <Preconditions>
        <Precondition attribute="Credibility" operation="less" value="Money" />
      </Preconditions>
      <Description>More money</Description>
      <Choices>
        <Choice>
          <Effects>
            <SetEffect attribute="Money" value="0" />
          </Effects>
          <Description>
                      Choice 1 description
                  </Description>
          <ChoiceText>Choice 1</ChoiceText>
        </Choice>
        <Choice>
          <Effects>
            <ModifyEffect attribute="Credibility" value="150" />
            <MoveTowardsEffect amount="100" attribute="Credibility" value="500" />
          </Effects>
          <Description>
                      Choice 2 long description
                  </Description>
          <ChoiceText>Choice 2 ChoiceText</ChoiceText>
        </Choice>
      </Choices>
    </MultipleChoiceEvent>
    <MultipleChoiceEvent name="Little of both">
      <Preconditions>
        <Precondition attribute="Credibility" operation="less" value="200" />
        <Precondition attribute="Money" operation="lessOrEqual" value="Credibility" />
      </Preconditions>
      <Description>More money</Description>
      <Choices>
        <Choice>
          <Effects>
            <SetEffect attribute="Money" value="0" />
          </Effects>
          <Description>
                      Choice 1 description
                  </Description>
          <ChoiceText>Choice 1</ChoiceText>
        </Choice>
        <Choice>
          <Effects>
            <ModifyEffect attribute="Credibility" value="150" />
            <MoveTowardsEffect amount="100" attribute="Credibility" value="500" />
          </Effects>
          <Description>
                      Choice 2 long description
                  </Description>
          <ChoiceText>Choice 2 ChoiceText</ChoiceText>
        </Choice>
      </Choices>
    </MultipleChoiceEvent>
    <MultipleChoiceEvent name="Late">
      <Preconditions>
        <Precondition attribute="date" operation="greater" value="2016-09-09" />
      </Preconditions>
      <Description>More money</Description>
      <Choices>
        <Choice>
          <Effects>
            <SetEffect attribute="Money" value="0" />
          </Effects>
          <Description>
                      Choice 1 description
                  </Description>
          <ChoiceText>Choice 1</ChoiceText>
        </Choice>
        <Choice>
          <Effects>
            <ModifyEffect attribute="Credibility" value="150" />
            <MoveTowardsEffect amount="100" attribute="Credibility" value="500" />
          </Effects>
          <Description>
                      Choice 2 long description
                  </Description>
          <ChoiceText>Choice 2 ChoiceText</ChoiceText>
        </Choice>
      </Choices>
    </MultipleChoiceEvent>
  </Events>
</Scenario>