<?xml version="1.0" encoding="utf-8"?>
<?xml-stylesheet type="text/xsl" href="../../../Resources/Scenarios/scenario_stylesheet.xslt"?>
<Scenario name="name, only for the designer" xmlns="http://presstoplaygame.com/scenario" xmlns:xsi="http://www.w3.org/2001/XMLSchema-instance" xsi:schemaLocation="http://presstoplaygame.com/scenario ../../../Resources/Scenarios/scenario_schema.xsd">
  <Events>
    <MultipleChoiceEvent date="2016-11-30">
      <Preconditions>
        <Precondition attribute="Credibility" operation="equal" value="999" />
      </Preconditions>
      <Description>Event 1 description
          </Description>
      <Choices>
        <Choice>
          <Effects>
            <SetEffect attribute="Money" value="0" />
          </Effects>
          <Description>
                      Choice 1 description
                  </Description>
          <ChoiceText>Choice 1</ChoiceText>
        </Choice>
        <Choice>
          <Effects>
            <ModifyEffect attribute="Credibility" value="150" />
            <MoveTowardsEffect amount="100" attribute="Credibility" value="500" />
          </Effects>
          <Description>
                      Choice 2 long description
                  </Description>
          <ChoiceText>Choice 2 ChoiceText</ChoiceText>
        </Choice>
      </Choices>
    </MultipleChoiceEvent>
    <MultipleChoiceEvent date="2016-11-30">
      <Preconditions>
        <Precondition attribute="Credibility" operation="equal" value="250" />
      </Preconditions>
      <Description>Credibility is 250.</Description>
      <Choices>
        <Choice>
          <Effects>
            <SetEffect attribute="Money" value="0" />
          </Effects>
          <Description>
                      Choice 1 description
                  </Description>
          <ChoiceText>Choice 1</ChoiceText>
        </Choice>
        <Choice>
          <Effects></Effects>
          <Description>
                      Choice 2 long description
                  </Description>
          <ChoiceText>Choice 2 ChoiceText</ChoiceText>
        </Choice>
      </Choices>
    </MultipleChoiceEvent>
    <MultipleChoiceEvent date="2016-12-01">
      <Preconditions>
        <Precondition attribute="Credibility" operation="greater" value="549" />
      </Preconditions>
      <Description>High credibility!</Description>
      <Choices>
        <Choice>
          <Effects>
            <MoveTowardsEffect amount="25" attribute="Money" value="500" />
          </Effects>
          <Description>
                      Choice 1 description
                  </Description>
          <ChoiceText>Choice 1</ChoiceText>
        </Choice>
        <Choice>
          <Effects>
            <ModifyEffect attribute="Money" value="150" />
          </Effects>
          <Description>
                      Choice 2 long description
                  </Description>
          <ChoiceText>Choice 2 ChoiceText</ChoiceText>
        </Choice>
      </Choices>
    </MultipleChoiceEvent>
    <CutsceneEvent>
      <ImagePath>Some/Image/Path</ImagePath>
      <Text>Unconditional conditional!</Text>
    </CutsceneEvent>
  </Events>
</Scenario>